,Title,Publication Information,Publisher,Author,year,Abstract
0,[BOOK][B] Web scraping with Python: Collecting more data from the modern web,R Mitchell - 2018 - books.google.com,Web scraping with Python: Collecting more data from the modern web,R Mitchell ,2018,"… and misconceptions about web scraping, while providing a comprehensive guide to most 
common web scraping tasks. Web scraping is a … Because the scope of the field is so broad, 
this book covers the fundamental basics of web scraping and crawling in Part I and delves into …"
1,Web scraping technologies in an API world,"D Glez-Peña, A Lourenço… - Briefings in …, 2014 - academic.oup.com",[HTML] oup.com,D Glez,2014,"… We have selected several available Web scraping packages oriented to programmers. There 
are six libraries implementing an HTTP … We have selected several available Web scraping 
packages oriented to programmers. There are six libraries implementing an HTTP client (C) …"
2,[PDF][PDF] Web scraping,"B Zhao - Encyclopedia of big data, 2017 - researchgate.net",[PDF] researchgate.net,B Zhao ,2017,"… Of the various types of web scraping programs, some are created to automatically recognize 
the data structure of a page, such as … web-based graphic interface that eliminates the need 
for manually written web scraping code, such as Import.io. Nutch is a robust and scalable web …"
3,A comparative study on web scraping,DS Sirisuriya - 2015 - ir.kdu.ac.lk,[PDF] kdu.ac.lk,DS Sirisuriya ,2015,"… clarification about web scraping techniques and famous web scraping software. To accomplish 
this, we compare and contrast several web scraping techniques and some famous web 
scraping software. The outcome of this study offers a review on web scraping techniques and …"
4,[BOOK][B] Web scraping with Python,R Lawson - 2015 - books.google.com,[PDF] andrewhenke.com,R Lawson ,2015,"… When practical we will implement our own version of web scraping techniques so that you 
understand how they work before introducing … an automated solution using the web scraping 
techniques covered in this book. In an ideal world, web scraping would not be necessary and …"
5,[BOOK][B] Automated data collection with R: A practical guide to web scraping and text mining,"S Munzert, C Rubba, P Meißner, D Nyhuis - 2014 - books.google.com",[PDF] researchgate.net,"S Munzert, C Rubba, P Meißner, D Nyhuis ",2014,"… pages cm Summary: “This book provides a unified framework of web scraping and information 
extraction from text data with R for the … of the architecture of the Web, we now turn to data 
collection in practice. In this chapter, we address three main aspects of web scraping with R. …"
6,Web scraping: state-of-the-art and areas of application,"R Diouf, EN Sarr, O Sall, B Birregah… - … Conference on Big …, 2019 - ieeexplore.ieee.org",Web scraping: state-of-the-art and areas of application,"R Diouf, EN Sarr, O Sall, B Birregah… ",2019,"… The purpose of this article is to revisit the different existing Web Scraping approaches, 
categories, and tools, but also its areas of … We have also dealt with the area of applications of 
web scraping. At the end of this study, we have noticed that Web scraping is more needed in one …"
7,[PDF][PDF] Legality and ethics of web scraping,"V Krotov, L Silva - 2018 - researchgate.net",[PDF] researchgate.net,"V Krotov, L Silva ",2018,"… Web (often referred to as Web Scraping) for industry and academic research projects is 
becoming a common practice. A variety of tools and technologies have been developed to facilitate 
Web Scraping… Web Scraping in both courts and legal literature, the ethics of Web Scraping …"
8,[PDF][PDF] Exploiting web scraping in a collaborative filtering-based approach to web advertising.,"E Vargiu, M Urru - Artif. Intell. Res., 2013 - academia.edu",[PDF] academia.edu,"E Vargiu, M Urru ",2013,"… In this paper, we present a collaborative filtering-based Web advertising system that exploits 
Web scraping techniques to suggest … of Web scraping to perform Web advertising, in this 
paper we do not take into account legal issues on adopting and implementing Web scraping …"
9,Web scraping,"R Egger, M Kroner, A Stöckl - Applied Data Science in Tourism, 2022 - Springer",Web scraping,"R Egger, M Kroner, A Stöckl ",2022,"In this chapter, a number of tools for crawling websites are presented, and an example using 
hotel ratings has been adopted in order to specifically show how these can be extracted from 
a rating platform. For this purpose, Python with the library “BeautifulSoup” is used. Other …"
10,Understanding the requirements of the Indian IT industry using web scrapping,"P Pillai, D Amin - Procedia Computer Science, 2020 - Elsevier",[PDF] sciencedirect.com,"P Pillai, D Amin ",2020,"… Using web scrapping we extracted jobs details from different companies as shown in Figure 
2. For the process of web scrapping we used selenium and beautiful soup modules of python. 
Individual job links from each company’s job search site is extracted and then each job …"
11,[PDF][PDF] Diverse Relevance Ranking in Web Scrapping for Multimedia Answering,"R Priyambiga, D Shanthi - … Journal of System Design and Information …, 2014 - centivens.com",[PDF] centivens.com,"R Priyambiga, D Shanthi ",2014,"… In order to pull together multimedia records from the web, we generate queries from each QA 
pair. Here we generate three types of inquiry … - ship-oriented semantic hunt on the Web, for 
detecting entities and relations in Web pages and reasoning about them in expressive logics …"
12,Implementasi Web Scrapping dan Text Mining untuk Akuisisi dan Kategorisasi Informasi dari Internet (Studi Kasus: Tutorial Hidroponik),"A Priyanto, MR Ma'arif - Indonesian Journal of Information Systems, 2018 - ojs.uajy.ac.id",[PDF] uajy.ac.id,"A Priyanto, MR Ma'arif ",2018,"… teknik web scraping yang dikombinasikan dengan text mining untuk secara otomatis 
mengakuisisi informasi dari lamanlaman web yang … Dalam penelitian ini web scraping 
digunakan untuk mengambil data dari sebuah laman web kemudian melakukan transformasi dari …"
13,WEB-SCRAPPING,"MS Goncharov, EB Mikhailova - X Всероссийский фестиваль науки, 2020 - elibrary.ru",WEB-SCRAPPING,"MS Goncharov, EB Mikhailova ",2020,"… This way of collecting data from the web is usually called web scrapping. To start talking about 
technical … Popular approach for web-design that does not require user to reload the page 
when … Grabber - program, that performs web scrapping. This is rather slow in comparison with …"
14,[PDF][PDF] Web scraping,"B Zhao - Encyclopedia of big data, 2017 - researchgate.net",[PDF] researchgate.net,B Zhao ,2017,"… A web application may adopt one of the following measures to stop or interfere with a web 
scrapping tool that collects data from the given website. Those measures may identify whether 
an operation was conducted by a human being or a bot. Some of the major measures …"
15,Forecasting Harga Saham Menggunakan Metode Simple Moving Average Dan Web Scrapping,"DT Anggraeni - Jurnal Ilmiah Matrik, 2019 - journal.binadarma.ac.id",[PDF] binadarma.ac.id,DT Anggraeni ,2019,"… Adapun untuk mendapatkan data harga saham akan digunakan metode Web Scrapping 
yaitu mengambil data langsung dari situs … Web Scrapping adalah proses pengambilan 
dokumen semi terstruktur dari internet, umumnya berupa halaman-halaman web dalam bahasa …"
16,New biostatistics features for detecting web bot activity on web applications,"RU Rahman, DS Tomar - Computers & Security, 2020 - Elsevier",New biostatistics features for detecting web bot activity on web applications,"RU Rahman, DS Tomar ",2020,"… Most part of the existing research is focused on specific web bot detection such as form 
spamming bot, data scrapping bots, chat bots, and game bots. In this paper, the web bot 
detection model is … It is also used for web scrapping and web form submission. It can analyze …"
17,Web crawling-based search engine using python,"S GOEL, M BANSAL, AK SRIVASTAVA… - 2019 3rd International …, 2019 - ieeexplore.ieee.org",Web crawling-based search engine using python,"S GOEL, M BANSAL, AK SRIVASTAVA… ","2019, 3, 2019","… • WEB SCRAPPING Web scrapping is a programming system of extricating data from sites. 
This method for the most part centers around the change of … Although web scrapping is 
definitely not another term, in years past the Web Crawling-based Search Engine using Python …"
18,Web Scrapping: Data Extraction from Websites,"ISH Almaqbali, FMA Al Khufairi, MS Khan… - Journal of Student …, 2019 - jsr.org",[PDF] jsr.org,"ISH Almaqbali, FMA Al Khufairi, MS Khan… ",2019,"… Extracting Data from websites is commonly referred as Web Scrapping, which refers to 
both manual and … web scrapping tools like Beautiful Soup, Octoparse, Parsehub etc. In this 
article we are going to analyses few recent Web Scrappers tools used in scrapping the Web…"
19,Fake news detection,"A Jain, A Kasbe - 2018 IEEE International Students' Conference …, 2018 - ieeexplore.ieee.org",Fake news detection,"A Jain, A Kasbe ","2018, 2018","… web scrapping was introduced which gave us an insight into how we can update our dataset on 
regular basis to check the truthfulness of the recently updated Facebook posts.. Web Scrapping 
… data which will be obtained using web scrapping technique we will mark it as ""FAKE"". …"
20,Web scraping technologies in an API world,"D Glez-Peña, A Lourenço… - Briefings in …, 2014 - academic.oup.com",[HTML] oup.com,D Glez,2014,"… [ 15 ], OReFil [ 16 ] and MEDPIE [ 17 ] acknowledge (or had acknowledged at some point) the 
use of Web data scraping. Moreover, different examples of Web data scrapping can be found 
in recent domain-specific applications across Life Sciences, such as in Biotechnology and …"
21,[PDF][PDF] An intelligent survey of personalized information retrieval using web scraper,"BG Dastidar, D Banerjee, S Sengupta - International Journal of …, 2016 - mecs-press.org",[PDF] mecs-press.org,"BG Dastidar, D Banerjee, S Sengupta ",2016,"… The question that arises is whether the process of web scrapping is legal or whether it complies 
with the terms and conditions of each and … the web scrapping process has been discussed. 
The initial history of web scrapping was not very positive as the concept of web scrapping …"
22,[PDF][PDF] A survey on HTML structure aware and tree based web data scraping technique,"VB Kadam, GK Pakle - International Journal of Computer Science and …, 2014 - Citeseer",[PDF] psu.edu,"VB Kadam, GK Pakle ",2014,"… by lots of researchers to automate the process of web data scraping. Lots of techniques 
depends on the structure of web page ie html structure or DOM tree structure to scrap data from 
web page. In this paper we are presenting survey of HTML aware web scrapping techniques. …"
23,Current state and development of Airbnb accommodation offer in 167 countries,"C Adamiak - Current Issues in Tourism, 2019 - Taylor & Francis",[PDF] tandfonline.com,C Adamiak ,2019,"… Web-scrapping Airbnb website in fall 2018 and 2019 resulted in a datasets on 5.7 million 
listings, including 3.6 million active listings which have been rented out (reviewed) during the 
last year. Listings are divided into four groups based on types of properties and numbers of …"
24,[PDF][PDF] Auto-explore the web–web crawler,"S Chatterjee, A Nath - … Journal of Innovative Research in Computer …, 2017 - researchgate.net",[PDF] researchgate.net,"S Chatterjee, A Nath ",2017,"… A web crawler can identify all links in each page and then recursively continues. Web 
Crawlers also can extract content, that can be used for web scrapping. Web Crawler is used for 
many web systems starting from a simple program for just website backup to a major search …"
25,[PDF][PDF] Quantitative analysis of user-generated content on the web,"X Ochoa, E Duval - 2008 - ra.ethz.ch",[PDF] ethz.ch,"X Ochoa, E Duval ",2008,"… grouped under the name of Web 2.0 [18], enable user participation at a new level. Some 
Web sites use these technologies to add value to … We make use of those features to collect, 
through web scrapping or API use, the number of items produced by a sample of users for 11 …"
26,A survey: how Python pitches in it-world,"A Kumar, SP Panda - … on Machine Learning, Big Data, Cloud …, 2019 - ieeexplore.ieee.org",A survey: how Python pitches in it-world,"A Kumar, SP Panda ",2019,"… Python is well suited for web scrapping commercial developments, and also for various 
scientific computations. So the journey with python is enlightening for the programmers. So 
working with Python is a comfortable task for the programmers by which they can easily implement …"
27,[PDF][PDF] Automatic detection and banning of content stealing bots for e-commerce,"N Poggi, JL Berral, T Moreno, R Gavalda… - NIPS 2007 workshop …, 2007 - berralgarcia.com",[PDF] berralgarcia.com,"N Poggi, JL Berral, T Moreno, R Gavalda… ","2007, 2007","… , web scraping is part of a new breed of Internet abuses. Web scraping is shifting from simple 
plagiarism to profit-making using web advertising … Non-profit sites such as the Wikipedia 
have been particularly prone to scrapping for plagiarism [1], moreover, e-commerce sites are …"
28,International sharing economy: The case of airbnb in the Czech Republic,"A Ključnikov, V Krajčík, Z Vincúrová - Economics & Sociology, 2018 - search.proquest.com",International sharing economy: The case of airbnb in the Czech Republic,"A Ključnikov, V Krajčík, Z Vincúrová ",2018,"… market we have used a modern method of webscrapping of the data from AirBnb website. … 
Our IT team has developed a webscrapping tool, that was monitoring the AirBnB website for … 
that was also validated by our own data scrapping application, for a strength of our research…"
29,[PDF][PDF] WEB SCRAPPING TOOLS,"S Sharma, MN Kedia - ijaconline.com",[PDF] ijaconline.com,"S Sharma, MN Kedia ",,"… Web mining is one of the components of information mining Technique, which identifies with 
different research networks, for example, data … ideas of Web mining. We contain commonly 
centered around one of the classifications of Web mining, explicitly the Web Content Mining …"
30,Universal web pages content parser,"P Pawlas, A Domański, J Domańska - International Conference on …, 2012 - Springer",Universal web pages content parser,"P Pawlas, A Domański, J Domańska ",2012,"… As an answer to this need, the concept of web scrapping had been introduced [3]. Although 
Web pages parsing has been recently … rid of human intervention and create extraction rules 
of subject information from a large number of web pages [1,5]. Generally, it refers to the set of …"
31,Web scrapping and self service business intelligence: Analysis of preferences of tourists in Albania,A Hyseni - 2017 - knowledgecenter.ubt-uni.net,[PDF] ubt-uni.net,A Hyseni ,2017,"… were web scrapped from TripAdvisor.com by using tools for web scrapping, and for this paper 
were chosen the top 30 things to do in Albania. From TripAdvisor.com were web … Overall 
there were 5383 reviews which were web scrapped from top 30 things to do in Albania from …"
32,"[PDF][PDF] Web Scraping or Web Crawling: State of Art, Techniques, Approaches and Application.","MA Khder - International Journal of Advances in Soft Computing & …, 2021 - i-csrs.org",[PDF] i-csrs.org,MA Khder ,2021,"… Web scrapping is a technology that allow us to extract structured data from text such as 
HTML. Web scrapping is extremely useful in situations where data isn’t provided in machine 
readable format such as JSON or XML. The use of web scrapping to gather data allows us to …"
33,Abusive language detection on Indonesian online news comments,"DRK Desrul, A Romadhony - 2019 International Seminar on …, 2019 - ieeexplore.ieee.org",Abusive language detection on Indonesian online news comments,"DRK Desrul, A Romadhony ","2019, 2019","… 1) Web Scrapping/Web Crawling Web scraping and web crawling have similarities to take 
data on the website. The difference is web scrapping use for getting specic data on the website 
by taking part in paragraphs in the HTML structure and web crawling is using for getting all …"
34,A Study of Text Classification for Indonesian News Article,"GLY Londo, DH Kartawijaya… - 2019 International …, 2019 - ieeexplore.ieee.org",A Study of Text Classification for Indonesian News Article,"GLY Londo, DH Kartawijaya… ","2019, 2019","… We collected datasets by creating web scrapping functions. Next, we use the link from the 
article page and the type of article as input to the web scrapping function. In the web scrapping 
function, we use a beautifulSoup library to parse HTML. We take the 'p' tag for the article text …"
35,Researchgate data analysis to measure the strength of Indonesian research,"SN Edi, K Djati, WI Made… - Far East Journal of …, 2017 - eprints.binadarma.ac.id",[PDF] binadarma.ac.id,"SN Edi, K Djati, WI Made… ",2017,"… The development of the crawler application using the web scrapping is one of the solutions to 
collect data from the academic social network site in which it is not completed with Application 
Programming Interface (API) services, such as Researchgate.net. Researchgate.net data …"
36,A web scraping methodology for bypassing twitter API restrictions,"A Hernandez-Suarez, G Sanchez-Perez… - arXiv preprint arXiv …, 2018 - arxiv.org",[PDF] arxiv.org,A Hernandez,2018,"… Web scraping techniques are used to extract information from websites in an automatic way 
[19] by parsing hypertext tags and retrieving … At a glance, web scrapping seems an easy task 
but analyzing HTTP requests and responses [20] can be really complex. By using Scrapy, an …"
37,Ingredient/recipe algorithm using web mining and web scraping for smart chef,"S Chaudhari, R Aparna, VG Tekkur… - 2020 IEEE …, 2020 - ieeexplore.ieee.org",Ingredient/recipe algorithm using web mining and web scraping for smart chef,"S Chaudhari, R Aparna, VG Tekkur… ","2020, 2020","… ) of Amazon web services is used for implementing this cloud-based scrapping architecture. 
Web Crawler or web spider usually crawls … The authors of [4] presented web scrapping 
technique for collecting historical tweets within any date range using web scraping techniques …"
38,Development of IoT for automated water quality monitoring system,"RPN Budiarti, A Tjahjono, M Hariadi… - … on Computer Science …, 2019 - ieeexplore.ieee.org",[PDF] researchgate.net,"RPN Budiarti, A Tjahjono, M Hariadi… ",2019,"… in this study has a web-based output running on the sensor. The data displayed in HTML 
format and structured in a table. So we need a mechanism that can sort the sensor data from 
HTML based table and store the data taken in the database. By using web scrapping [2], we …"
39,[PDF][PDF] Intelligent information system to support decision-making based on unstructured web data,"M Bakaev, T Avdeenko - ICIC Express Letters, 2015 - academia.edu",[PDF] academia.edu,"M Bakaev, T Avdeenko ",2015,"… Even poorer coverage we observed in the aspect of how the information obtained from the 
web could be used and what decisions might … on non-technological considerations in web 
scrapping, such as actual and potential uses of the data obtained from the web. In Section 2 of …"
40,Criminals And Missing Children Identification Using Face Recognition And Web Scrapping,"S Ayyappan, S Matilda - 2020 International Conference on …, 2020 - ieeexplore.ieee.org",Criminals And Missing Children Identification Using Face Recognition And Web Scrapping,"S Ayyappan, S Matilda ","2020, 2020","… Web scrapping is a technique of extracting data and information from a website by accessing 
World Wide Web either directly through Hypertext Markup Language or by using a web browser. 
Python beautifulsoup is well known for web scrapping and it must use a parser to parse …"
41,[PDF][PDF] A Novel Approach for News Extraction Using Webscraping,"M Shreesha, SB Srikara… - … National Conference on …, 2018 - pdfs.semanticscholar.org",[PDF] semanticscholar.org,"M Shreesha, SB Srikara… ",2018,"… features of the web scrapping technology are that can scrape the content which is required. 
Web scrapping is used by the many companies for business. One of the example of the web 
scrapping in the real estate listing gathering, It is a huge and growing web scrapping area. …"
42,Relation extraction in clinical text using NLP based regular expressions,"G Veena, R Hemanth, J Hareesh - 2019 2nd International …, 2019 - ieeexplore.ieee.org",Relation extraction in clinical text using NLP based regular expressions,"G Veena, R Hemanth, J Hareesh ","2019, 2, 2019","… pages related to different diseases and extract different medical related information’s from 
it with the help of methods like web scrapping and regular expressions. Web pages are read 
into our system using web scrapping method. Medical data are extracted from web pages in …"
43,Universal semantic web assistant based on sequence to sequence model and natural language understanding,"SV Prajwal, G Mamatha, P Ravi… - 2019 9th International …, 2019 - ieeexplore.ieee.org",[PDF] researchgate.net,"SV Prajwal, G Mamatha, P Ravi… ","2019, 9, 2019","… Our Web based Virtual … the Web and queries the database through efficient web crawlers 
and through the Artificial Intelligence (AI), Machine Learning (ML), Deep Learning (DL) modules 
respectively. Each web crawlers are small programs written to crawl certain part of the web …"
44,Peramalan Harga Saham Menggunakan Metode Autoregressive Dan Web Scrapping Pada Indeks Saham Lq45 Dengan Python,"DT Anggraeni - Rabit: Jurnal Teknologi Dan Sistem Informasi …, 2020 - ojsbimtek.univrab.ac.id",[PDF] univrab.ac.id,DT Anggraeni ,2020,"… Data harga saham diambil secara otomatis dengan teknik Web Scrapping, sehingga 
menghasilkan nilai … Pada penelitian ini penulis menerapkan teknik Web Scrapping untuk 
pengambilan data agar … Data diambil dengan teknik Web Scrapping dari laman resmi Yahoo …"
45,[PDF][PDF] An Improving Approach for Fast Web Scrapping Using Machine Learning and Selenium Automation,"S Mehta, G Pandi - International Journal of Advanced Research in …, 2019 - academia.edu",[PDF] academia.edu,"S Mehta, G Pandi ",2019,"… web element counts from web page by using Machine Learning technique Count Vectorizer 
and using that list selenium will identify the new documents from web pages for scrapping … 
gathering data in the first round of scrapping by using Forward Selection Wrapper methods of …"
46,OPTIMASI HASIL PENCARIAN PADA WEB SCRAPPING MENGGUNAKAN PEMBOBOTAN KATA TF-IDF,"E Prayitno, T Suprawoto… - Journal of Innovation …, 2021 - bajangjournal.com",[PDF] bajangjournal.com,"E Prayitno, T Suprawoto… ",2021,"… to have to search for the desired information one by one on the web so that the time required 
becomes longer. This research uses web scraping and TF-IDF method. Web scraping is a 
technique for getting information from web pages. In doing scraping, curl and simple html dom …"
47,A machine learning-based sentiment analysis of online product reviews with a novel term weighting and feature selection approach,"H Zhao, Z Liu, X Yao, Q Yang - Information Processing & Management, 2021 - Elsevier",A machine learning-based sentiment analysis of online product reviews with a novel term weighting and feature selection approach,"H Zhao, Z Liu, X Yao, Q Yang ",2021,"… Web scraping software is exclusively adapted tool towards automatically extracting data from 
websites. These resources are beneficial to … data are processed using web scrapping tool 
to extract the data. Once the data are extracted in web scrapping, the reviewer comments are …"
48,[HTML][HTML] Dataset for evaluating the accessibility of the websites of selected Latin American universities,"P Acosta-Vargas, M González, S Luján-Mora - Data in brief, 2020 - Elsevier",[HTML] sciencedirect.com,P Acosta,2020,"… (1) Data analysis: web scrapping was initially applied to extract the Webometrics web to 
Excel. After extracting the data, the experts carried out a manual inspection of the data 
sample to detect data quality problems that might affect its properties. (2) Definition of the …"
49,Web Scraping with HTML DOM Method for Data Collection of Scientific Articles from Google Scholar,"A Rahmatulloh, R Gunawan - Indonesian Journal of Information …, 2020 - ojs.uajy.ac.id",[PDF] uajy.ac.id,"A Rahmatulloh, R Gunawan ",2020,"… Google Scholar adalah layanan berbasis web untuk mencari literatur akademik. Berbagai 
jenis referensi yang dapat diakses contohnya … Pengumpulan data dari Google Scholar 
dilakukan dengan menerapkan teknologi web scrapping. Eksperimen web scrapping dari Google …"
50,Automation testing software that aid in efficiency increase of regression process,"AN Bhatt, M Rajasekhara Babu… - Recent Patents on …, 2013 - ingentaconnect.com",Automation testing software that aid in efficiency increase of regression process,"AN Bhatt, M Rajasekhara Babu… ",2013,"… It automates the process with the help of web-scrapping algorithm (WSA) that includes 
HTML/XML parsing to extract the needed content in the form of GUI-Web Objects, than using 
Network-Binary Search Algorithm (N/W-BS-A) and Change Finder Algorithm, a variant of Binary …"
