,Title,Publication Information,Publisher,Author,year,Abstract
100,Modeling information space for decision-making in the interaction of higher education system with regional labor market,"T Avdeenko, M Bakaev - 2014 12th International Conference on …, 2014 - ieeexplore.ieee.org",[PDF] academia.edu,"T Avdeenko, M Bakaev ","2014, 12, 2014","… The particular features of the proposed approach are: accumulation of data with the use 
of web-scrapping intelligent information system, building multi-dimensional OLAP-warehouse 
with data consolidation and aggregation, analysis of data based on OLAP technology and …"
101,Political Polarization and Movie Ratings: Web Scraping The Brazilian Contemporary Scenario,"AP Moritz, B Chagas - 2020 - scholar.archive.org",Political Polarization and Movie Ratings: Web Scraping The Brazilian Contemporary Scenario,"AP Moritz, B Chagas ",2020,"… We develop a code on python to perform web-scrapping on the sample scope of Brazilian 
movies and interpret the data collected using a controversiality index based on standard 
deviation. The outcome sheds some light into the relation between Buzz and Controversiality …"
102,[PDF][PDF] Stock market prediction using machine learning,"J John, A Kumar, A Abhishek, TA Dhule⁴, A Roy… - Int. J. Res. Anal. Rev., 2020 - ijrar.org",[PDF] ijrar.org,"J John, A Kumar, A Abhishek, TA Dhule⁴, A Roy… ",2020,"… Here Scrapping refers to the collection of data ethically without violating the general norms set 
by the website from which we are collecting … the web platforms available to all for use hence 
it is known as Web Scrapping. Now we can see the general examples of web Scrapping in …"
103,[PDF][PDF] Network analysis of YouTube videos based on keyword search with graph centrality approach,"ES Negara, RA Ria Andryani - Indonesian Journal of …, 2021 - pdfs.semanticscholar.org",[PDF] semanticscholar.org,"ES Negara, RA Ria Andryani ",2021,"… Data is taken by a web scrapping technique using the python programming language. Web 
scrapping is a form of data mining that aims to mine information from websites that are different 
from unstructured and turn them into structured so that they can be understood [24], [25]. …"
104,"[PDF][PDF] Automated in Silico Identification of Drug Candidates for Coronavirus Through a Novel Programmatic Tool and Extensive Computational (MD, DFT) Studies of …","AS Ben Geoffrey, R Madaj, A Sanker… - 2020 - … .s3.amazonaws.com",[PDF] amazonaws.com,"AS Ben Geoffrey, R Madaj, A Sanker… ","2020, 3","… [1] which can be programmatically accessed through web API packages such as PUB-REST 
and python web scrapping techniques [2,3]. … leads for coronavirus through programmatic 
access of PubChem database and python web scrapping techniques [8,9]. The workflow of the …"
105,"A data-driven framework for walkability measurement with open data: A case study of triple cities, New York","C Deng, X Dong, H Wang, W Lin, H Wen… - … International Journal of …, 2020 - mdpi.com",[PDF] mdpi.com,"C Deng, X Dong, H Wang, W Lin, H Wen… ",2020,"… Three major steps of this framework include the web scrapping of publicly available online 
data, determining varying weights of variables, and generating a synthetic walkability index. 
The results suggest three major conclusions. First, the proposed framework provides an …"
106,Graph-based text summarization using modified TextRank,"C Mallick, AK Das, M Dutta, AK Das… - Soft computing in data …, 2019 - Springer",[PDF] researchgate.net,"C Mallick, AK Das, M Dutta, AK Das… ",2019,"… Structured data is preferably extracted through an API over Web screaping. Unfortunately not 
all Web sites provide an API because they do not want the users to extract data in structured 
way. We can perform Web scrapping to transform unstructured data in HTML or XML format …"
107,Evaluating future stock value asset using machine learning,"R Soujanya, PA Goud, A Bhandwalkar… - Materials Today …, 2020 - Elsevier",Evaluating future stock value asset using machine learning,"R Soujanya, PA Goud, A Bhandwalkar… ",2020,"… done by web scrapping in python or individually selecting the number of years of data we 
want and downloading the .xlsx file. The paper discusses the development of the predicting 
model using the python programming language. The model hits the NSE website to web scrap …"
108,Can crowdsourcing support co-productive transportation planning in megaregion? evidence from local practice,"GP Griffin, J Jiao - 2018 - rosap.ntl.bts.gov",[PDF] bts.gov,"GP Griffin, J Jiao ",2018,"… Abstract This project explores how different technologies (smart phone, social media, web 
scrapping) can facilitate coproductive transportation planning process in Megaregion. As case 
studies, GRAs explored bike-sharing planning in NYC, Chicago, Austin, San Antonio and …"
109,Real Estate Price's Forecasting through Predictive Modelling,"N Sharma, Y Arora, P Makkar, V Sharma… - Machine Learning for …, 2021 - Springer",Real Estate Price's Forecasting through Predictive Modelling,"N Sharma, Y Arora, P Makkar, V Sharma… ",2021,"… Web Scraping Internet is a very rich source of data and web scrapping is the best way for doing 
that. Web scraping also known as data fetching or web harvesting is a process or technique 
to pull out data from the websites. It can be done manually but regularly the term use for …"
110,Design of a Daily Brief Business Report Generator based on Web Scraping with KNN Algorithm,"G Lin, Y Liang, X Fu, G Chen, S Cai - Journal of Physics …, 2019 - iopscience.iop.org",[PDF] iop.org,"G Lin, Y Liang, X Fu, G Chen, S Cai ",2019,"… can be fetched from web pages with some necessary normalization and process. The process 
of extracting data from web pages is called as web scrapping, which is becoming increasingly 
useful as ever more information is available online [1]. Although web scraping is not a …"
111,Text Mining and Support Vector Machine for Sentiment Analysis of Tourist Reviews in Bangkalan Regency,"EM Rachman, IO Suzanti… - Journal of Physics …, 2020 - iopscience.iop.org",[PDF] iop.org,"EM Rachman, IO Suzanti… ",2020,"… The initial stage of the sentiment process analysis on this research is Web scrapping on the 
TripAdvisor site, the purpose of this stage to collect user review data. The review Data obtained 
will then be classified using the Support Vector Machine (SVM) method. Further review …"
112,A Cognizant agent system for optimizing cloud service searching strategy,"S Dhanasekaran, V Vasudevan - Cluster Computing, 2019 - Springer",A Cognizant agent system for optimizing cloud service searching strategy,"S Dhanasekaran, V Vasudevan ",2019,"… Cloud service searching technique is used to find relevant information on World Wide Web. 
Each search engine maintains following process in real time environment like web crawling, 
web scrapping, indexing and searching. The search engine over cloud is specially designed …"
113,[PDF][PDF] Sentiment Analysis: Gauging the Effect of News on Stock Prices in Indian Stock Market,"N Vijay, S Singh, G Malhotra - International Journal of Trade, Economics and …, 2018 - ijtef.org",[PDF] ijtef.org,"N Vijay, S Singh, G Malhotra ",2018,"… We have devised an algorithm that successfully determines polarity in financial texts using 
web scrapping and machine learning techniques in python to gather news texts from major 
financial news websites like Economic Times, Money Control, Reuters, The Hindu etc. The …"
114,[PDF][PDF] Movie Organizer Menggunakan Teknik Web Scrapping,"C Nugraha, IF Astuti… - Jurnal Informatika …, 2014 - fmipa.unmul.ac.id",[PDF] unmul.ac.id,"C Nugraha, IF Astuti… ",2014,"… Penelitian ini bertujuan untuk merancang sistem pada aplikasi desktop yang dapat 
mengimplementasikan teknik web scrapping atau ekstraksi web yaitu mengumpulkan dan 
menyusun informasi sebuah film dari sumber data secara online dengan format JSON yang …"
115,[PDF][PDF] BANK CHAT BOT–an intelligent assistant system using NLP and machine learning,"CS Kulkarni, AU Bhavsar, SR Pingale… - … Research Journal of …, 2017 - academia.edu",[PDF] academia.edu,"CS Kulkarni, AU Bhavsar, SR Pingale… ",2017,"… We intend to provide a chat bot interface for customers which could be available on the web 
and on any hand-held devices. Customers can mention their queries in natural language … 
We have used different web scrapping tools for this task. Distribution of questions in Data-set : …"
116,Application of sentiment analysis and topic modeling on rural solar PV issues: Comparison of news articles and blog posts,"J Ki, S Ahn - Journal of Digital Convergence, 2020 - koreascience.or.kr",[PDF] koreascience.or.kr,"J Ki, S Ahn ",2020,"… Texts are gained from online news articles and blog posts with rural solar PV as a keyword 
by web scrapping, and these are analysed by sentiment analysis and topic modeling technique. 
Sentiment analysis shows that the proportion of negative texts are significantly lower in …"
117,[PDF][PDF] Webscrapping avec R,"L Vaudor, S Rey-Coyrehourcq, F Pfaender - 2018 - halshs.archives-ouvertes.fr",[PDF] archives-ouvertes.fr,"L Vaudor, S Rey",2018,"Please note that while during the course we had geocoded using the geocode. xyz API, this 
might not be optimal for geocoding with R. This choice was due to the fact that we wanted to 
show you how to use an API in a direct query. You can also geocode using other APIs with …"
118,Ethereum transaction graph analysis,"W Chan, A Olmsted - 2017 12th international conference for …, 2017 - ieeexplore.ieee.org",[PDF] researchgate.net,"W Chan, A Olmsted ","2017, 12, 2017","… • The Classifier component reads the two graphs created from the Grapher, enriches it with 
labels that are scrapped from the web and persists … Aside from graph analytics, we can apply 
web scrapping to associate addresses with tags such as those provided by Etherscan or user …"
119,Reinforcing Web Accessibility for Enhanced Browsers and Functionalities According to W3C Guidelines,"N Joshi, M Tijare - Proceedings of the Second International Conference …, 2016 - Springer",[PDF] researchgate.net,"N Joshi, M Tijare ",2016,"… of designing accessible web sites and even for those who have taken a deep dive in web 
designing in making Web accessible to all. This … rate a web site on accessibility checkpoints 
by W3C (WCAG 2.0). Efforts are made in attaining web accessibility using web scrapping as a …"
120,Korean Web Content Extraction using Tag Rank Position and Gradient Boosting,"J Mo, JM Yu - Journal of KIISE, 2017 - koreascience.or.kr",Korean Web Content Extraction using Tag Rank Position and Gradient Boosting,"J Mo, JM Yu ",2017,"… A content block tends to be located in the middle of a web page. In particular, Korean web 
documents rarely include metadata and have a … of this paper shows that the content extraction 
method can be used to collect high-quality text data automatically from various web pages. …"
121,Nahuatl Neural Machine Translation Using Attention Based Architectures: A Comparative Analysis for RNNs and Transformers as a Mobile Application Service,"SK Bello García, E Sánchez Lucero… - … Conference on Artificial …, 2021 - Springer",Nahuatl Neural Machine Translation Using Attention Based Architectures: A Comparative Analysis for RNNs and Transformers as a Mobile Application Service,"SK Bello García, E Sánchez Lucero… ",2021,"… disposal of word-segmentation and Web Scrapping techniques; including the lack of a 
proper online tool translation for Nahuatl dialect, inspired this work in an effort to produce such 
a tool. Once availability of suitable corpus via Web Scrapping is searched for with scrutiny, …"
122,307ChopShop Senior Design Web Scraper,A Tarango - mountainscholar.org,307ChopShop Senior Design Web Scraper,A Tarango ,,"… This past year I have worked with a group of computer science students to make a web 
scrapping application for our senior design project. My task was to create and implement a 
Facebook marketplace API. Both eBay and Craigslist already have public-facing APIs so it was …"
123,Retail price analytics using backpropogation neural network and sentimental analysis,"N Kalaiselvi, KR Aravind, S Balaguru… - … Conference on Signal …, 2017 - ieeexplore.ieee.org",Retail price analytics using backpropogation neural network and sentimental analysis,"N Kalaiselvi, KR Aravind, S Balaguru… ",2017,"… Web scrapping is a process of scrapping data from websites. The basic requirement to 
perform web scrapping is the source code of the website that need scrapping. … In our project, 
we will use web scrapping and LXML parsing to extract data. Once the data is extracted, the data …"
124,[CITATION][C] Data extraction and sentimental analysis from “twitter” using web scrapping,"M Jain, S Vaish, M Patil, GM Anant - … of Engineering and Advanced Technology. https …, 2019",Save,"M Jain, S Vaish, M Patil, GM Anant ",2019,
125,Interest-Based News Feed,"U Gupta, A Saini, A Gupta - … of International Conference on Recent Trends …, 2022 - Springer",Interest-Based News Feed,"U Gupta, A Saini, A Gupta ",2022,"… scrapping different Web sites and performing news summarization are time taking tasks; 
therefore, we cannot deploy just one server for web scrapping [… of two servers, one will perform 
Web scrapping for collecting news articles from several news Web sites and the other one will …"
126,[PDF][PDF] Engaging People's Enthusiasm in 2020 Population Census by Scrapping Social Media,"OW Putra, ST Stat, NS Purba, F Mansyur, M Faris… - 2021 - unece.org",[PDF] unece.org,"OW Putra, ST Stat, NS Purba, F Mansyur, M Faris… ",2021,"… YouTube video data of 2020 population census were collected through web scrapping 
by … As for Instagram web scrapping result from August 1st – December 15th 2019, the … 
From Twitter web scrapping, 3 694 tweets from 1,737 accounts were accumulated. Therefore, …"
127,Sentiment Analysis for E-Commerce Products Using Natural Language Processing,"BK Jha, GG Sivasankari… - Annals of the …, 2021 - eprints-bangaloreuniversity.in",[PDF] eprints-bangaloreuniversity.in,"BK Jha, GG Sivasankari… ",2021,"… We have also used FLASK-based Restful APIs and Scrapy for web scrapping to collect 
useful data from an e-commerce site. Our findings indicate that the proposed method of Natural 
Language Processing (NLP) for e-commerce products in real-time has enhanced efficiency in …"
128,[PDF][PDF] Data science applied to extract insights from data-weather data influence on traffic accidents,"M Novkovic, M Arsenovic, S Sladojevic… - INFOTEH …, 2017 - researchgate.net",[PDF] researchgate.net,"M Novkovic, M Arsenovic, S Sladojevic… ",2017,"… We rely on publicly available meteorological data and web scrapping as a form of gathering 
large amount of traffic accident data in a period of 15 years. Rainfall, daily changes in temperature, 
cloudiness, and humidity have been found to be in correlation with the occurrences of …"
129,Cross-domain query answering: Using Web scrapper and data integration,"D Mishra, N Pujari - 2011 2nd International Conference on …, 2011 - ieeexplore.ieee.org",Cross-domain query answering: Using Web scrapper and data integration,"D Mishra, N Pujari ","2011, 2, 2011","… Step 4: Next access pattern that we did is scrapping temperature ie average temperature of 
each location. The average location could be … Step 5: Successful completion of web 
scrapping from conference and temperature services will ensure the user with access of result of …"
130,[PDF][PDF] Survey on Web scraping technology,"BS Manjushree, GS Sharvani - Wutan Huatan Jisuan Jishu, 2020 - wthtjsjs.cn",[PDF] wthtjsjs.cn,"BS Manjushree, GS Sharvani ",2020,"… the data extraction process of web scraping, various web scraping strategies and most of the 
latest tools utilized to scrap web. The primary … This is an easy web scrapping tool for information 
extraction. This is an extension to a specific website that lets to convert information into …"
131,ChoseAmobile: A Web-based Recommendation System for Mobile Phone Products,"S Akram, S Hussain, IK Toure, S Yang… - Journal of Internet …, 2020 - jit.ndhu.edu.tw",[PDF] ndhu.edu.tw,"S Akram, S Hussain, IK Toure, S Yang… ",2020,"… web mining enables users to analyze prices and obtain desired products at the lowest price. 
Users can also choose multiple products that belong to the same category to compare their 
functionality. To get the best price from e-commerce sites, web crawlers and web scrapping …"
132,Used of Web Scraping on Knowledge Representation Model for Bodies of Knowledge as a Tool to Development Curriculum,"PA Quezada-Sarmiento, JA Elorriaga… - World Conference on …, 2021 - Springer",Used of Web Scraping on Knowledge Representation Model for Bodies of Knowledge as a Tool to Development Curriculum,PA Quezada,2021,"… Web scraping focuses more on the transformation of data without structure on the web (such … 
There are different libraries as well as software applications to apply web scraping, for this … 
Information extraction using web usage mining, web scrapping and semantic annotation. In: …"
133,Prediksi Harga Rumah Menggunakan Web Scrapping Dan Machine Learning Dengan Algoritma Linear Regression,"A Saiful - JATISI (Jurnal Teknik Informatika dan Sistem Informasi), 2021 - jurnal.mdp.ac.id",[PDF] mdp.ac.id,A Saiful ,2021,"… Dengan melakukan web scrapping memungkinkan untuk mengumpulkan data dengan 
jumlah besar [8] dan mendapatkan sumber data terkait yang semua variable tersebut 
dikumpulkan secara berkala disetiap harinya mulai dari 1 Oktober 2020 hingga 31 Oktober 2020 …"
134,[PDF][PDF] Weather report on metropolitan cities in India using web scraping technique,"S Singh, R Jain - Int. J. Adv. Res. Ideas Innovations Technol, 2019 - academia.edu",[PDF] academia.edu,"S Singh, R Jain ",2019,"… For this, in this research, we use web scraping technology to collect meteorological data in 
… , this study uses Web Scraping technology to collect data from sites that provide information 
on the web. The … Research [2] mentions the Web Scrapping and Semantic Annotation briefly. …"
135,Harvesting unstructured data in heterogenous business environments; exploring modern web scraping technologies,RM Vording - 2021 - essay.utwente.nl,[PDF] utwente.nl,RM Vording ,2021,"… For collecting data efficiently, web scraping technology can be used. Web scraping, also 
known as web harvesting or web extraction and considered to be a part of data mining, is a 
technique that consists of retrieving data from the internet and stores it into a file or database [25]. …"
136,Web Scraping based Smart irrigation system with telegram alerts for farmers,"N Telagam, U Somanaidu, B Naresh… - 2021 Fourth …, 2021 - ieeexplore.ieee.org",Web Scraping based Smart irrigation system with telegram alerts for farmers,"N Telagam, U Somanaidu, B Naresh… ","2021, 2021","… The website link data for housing market analysis and behaviour of humans are explained 
using the web scraping method [12]. To conduct a … An innovative irrigation system is proposed 
in this article, and it entirely depends on the web scraping technique. This web scraping …"
137,Pengembangan Aplikasi Analisis Sentimen Twitter Menggunakan Metode Naïve Bayes Classifier (Studi Kasus SAMSAT Kota Malang),"IF Rozi, EN Hamdana, MBI Alfahmi - Jurnal Informatika Polinema, 2018 - jip.polinema.ac.id",[PDF] polinema.ac.id,"IF Rozi, EN Hamdana, MBI Alfahmi ",2018,"… Data diperoleh melalui cara web scrapping dan sumber teks yang digunakan sebagai topik 
bahasan adalah Sistem Administrasi Manunggal Satu Atap (SAMSAT) Malang Kota. Proses 
klasifikasi dilakukan melalui serangkaian tahapan seperti preproses (case folding, cleaning, …"
138,"Barcelona seen through the eyes of TripAdvisor: Actors, typologies and components of destination image in social media platforms","L Garay Tamajón, G Cànoves Valiente - Current Issues in Tourism, 2017 - Taylor & Francis","Barcelona seen through the eyes of TripAdvisor: Actors, typologies and components of destination image in social media platforms","L Garay Tamajón, G Cànoves Valiente ",2017,"… Information from the posts was captured using webscrapping methods and the resulting 
documents were analysed with Computer-Aided Text … With respect to the information in the 
Turisme de Barcelona web, the treatment was simpler because the information was relatively fixed …"
139,[PDF][PDF] Football (soccer) analytics: A case study on the availability and limitations of data for football analytics research,"R Asif, MT Zaheer, SI Haque… - International Journal of …, 2016 - academia.edu",[PDF] academia.edu,"R Asif, MT Zaheer, SI Haque… ",2016,"… and the eventual method used were to gather the rating data was to create a Web Scrapper. 
… Therefore the scrapping process had to be automated. There was a need to create an … code 
also known as Callback Hell within the web community. To eradicate this problem, CasperJS …"
140,A comparative study of various approaches to adaptive web scraping,"K Mehta, M Salvi, R Dand, V Makharia, P Natu - ICDSMLA 2019, 2020 - Springer",A comparative study of various approaches to adaptive web scraping,"K Mehta, M Salvi, R Dand, V Makharia, P Natu ","2019, 2020","… Google Docs: Google sheets is a popular scrapping tool. The scraper uses the IMPORTXML 
function to scrape data from websites. This … The web browser is connected to the AWS 
web server using REST API [4]. The scrapehub handles all client requests and assigns the …"
141,Threats of price scraping on e-commerce websites: attack model and its detection using neural network,"RU Rahman, DS Tomar - Journal of Computer Virology and Hacking …, 2021 - Springer",Threats of price scraping on e-commerce websites: attack model and its detection using neural network,"RU Rahman, DS Tomar ",2021,"… part we present the existing research on web bot detection techniques and in second part we 
present the automated web scraping tools. … We have developed the price scrapping attack 
model in two parts. First phase is the construction of a web crawler and the second phase is …"
142,Faceted Search on Amazon Data using Naïve Bayes Approach,"Y Yogesh, KK Bhatia, N Duhan… - … , and Intelligent Systems …, 2021 - ieeexplore.ieee.org",Faceted Search on Amazon Data using Naïve Bayes Approach,"Y Yogesh, KK Bhatia, N Duhan… ",2021,"… mining and web mining in an information retrieval system for web data integration. Webpages 
in web scrapping are produced of amazon E-commerce website by markup languages which 
are text based such as (HTML or XHTML) files. In this work, web scrapping considers that …"
143,[CITATION][C] Web scrapping meets survey design: Combining forces. BigSurv Conference,"O Ten Bosch, D Windmeijer, A van Delden… - October",Save,"O Ten Bosch, D Windmeijer, A van Delden… ",,
144,[PDF][PDF] Web-Based Automation Testing Framework,"A Jain, S Prabu, SMR Ghalib - International Journal of Computer …, 2012 - Citeseer",[PDF] psu.edu,"A Jain, S Prabu, SMR Ghalib ",2012,"… For GUI Application we are creating web objects of the web elements like button,dropdown,graph 
,page etc so that test cases can use the object … Web Scrapping Algorithm fetches html 
source code for producing locators for uniquely identifying and locating the web objects. The …"
145,Application of ontology in semantic web searching of flight ticket as a study case,"TN Turnip, EK Silalahi, YAV Sinulingga… - Journal of Physics …, 2019 - iopscience.iop.org",[PDF] iop.org,"TN Turnip, EK Silalahi, YAV Sinulingga… ",2019,"… Semantic web is considered as one solution to the problem. Semantic Web requires 
appropriate scrapping of data to retrieve the online data from specified websites. By using 
ontology, the semantic web can collect the data and enhance the search process of flight ticket. …"
146,[PDF][PDF] Semantic text analysis using machine learning,"B Joga, S Sattiraju, V Kandula, NM Kallempudi… - 2019 - academia.edu",[PDF] academia.edu,"B Joga, S Sattiraju, V Kandula, NM Kallempudi… ",2019,"… We have built a demonstration system using these technics like Web Scrapping, Fuzzy C-Means 
and Hierarchy Clustering for a search engine which gives accurate results which is a more 
advantage when compared to other Search engines. Searching with a traditional, …"
147,[PDF][PDF] Automatic Approach For Lifelog Moments Retrieval using Transfer Learning and Rule-based Matching.,"FB Abdallah, G Feki, O Saadallah, A Jarraya… - CLEF (Working …, 2020 - dei.unipd.it",[PDF] unipd.it,"FB Abdallah, G Feki, O Saadallah, A Jarraya… ",2020,"… Also, we use web scrapping to add new image classes to the fine-tuning. The images are 
sorted according to their score obtained from the classification using the fine-tuning with 
MobilenetV2 [34] or by using the average score given by the Place CNN trained on Place 365 …"
148,Sistem Pendukung Keputusan Rekomendasi Barang Online Menggunakan Metode Web Scrapping dan Fuzzy-Simple Additive Weighting (SAW)(Studi Kasus: E …,B Saputra - 2016 - repository.ub.ac.id,Sistem Pendukung Keputusan Rekomendasi Barang Online Menggunakan Metode Web Scrapping dan Fuzzy-Simple Additive Weighting (SAW)(Studi Kasus: E …,B Saputra ,2016,"Electronic Commerce (E-commerce) adalah media yang digunakan untuk melakukan 
transaksi jual beli online, E-commerce mengalami pertumbuhaan yang sangat pesat pada 
satu dekade terakhir, ditunjukkan dengan maraknya iklan E-commerce yang tayang di televisi, …"
