,Title,Publication Information,Publisher,Author,year,Abstract
248,Web Automation in Health Care,"S Ganesh, AP Celestina, R Jayashree… - … on Innovations in …, 2019 - ieeexplore.ieee.org",Web Automation in Health Care,"S Ganesh, AP Celestina, R Jayashree… ",2019,"… Our project aims at automation of web using RPA technology in healthcare industry, where 
a software robot or bot that mimics a human … This paper highlights the data extraction from 
web which is considered as massive data container. Constructing the web data extraction …"
249,ANALYSIS OF INTER-RELIGIOUS TOLERANCE SENTIMENTS IN INDONESIA ON CONVERSATIONS ON SOCIAL MEDIA TWITTER,"Y Pribadi, N Hafidz, Y Nuryamin… - Pilar Nusa Mandiri …, 2020 - ejournal.nusamandiri.ac.id",[PDF] nusamandiri.ac.id,"Y Pribadi, N Hafidz, Y Nuryamin… ",2020,"… Data collection is done through web scrapping data from Twitter. Web scraping is a process 
used to extract data from the desired website by … Web Scrapping is used to convert unstructured 
data on the web into structured data stored and analyzed in a database or spreadsheet (…"
250,[PDF][PDF] Spatial influence in Basque Country's hotel prices,"A Juarez, A Badiola, J Aramendi - europeansurveyresearch.org",[PDF] europeansurveyresearch.org,"A Juarez, A Badiola, J Aramendi ",,"… The Basque Country’s hotel’s prices were collected thanks to a personalized web scrapping 
technique developed by the Basque Statistics Office, Eustat. Moreover, complementary 
information was collected from the Directory of Tourist Establishments of Eustat. This …"
251,[PDF][PDF] Human Being Character Analysis from Their Social Networking Profiles,"B Samal, M Panda - researchgate.net",[PDF] researchgate.net,"B Samal, M Panda ",,"… Oauth2.0 protocol is used for login into the LinkedIn and web scrapping using JavaScript 
is used for information extraction of the registered users. Then, Word Net: a lexical database 
is used for forming the word clusters such as: extrovert and introvert using semi-supervised …"
252,Modelling Cyber-Risk in an Economic Perspective,"I Bothos, V Vlachos, DM Kyriazanos… - … on Cyber Security …, 2021 - ieeexplore.ieee.org",Modelling Cyber-Risk in an Economic Perspective,"I Bothos, V Vlachos, DM Kyriazanos… ",2021,"… Also we present work performed in the framework of SAINT H2020 Project [1], concerning 
innovative data mining techniques, based on automated web scrapping, for the retrieving of 
the relevant time-series data. We conclude with a review of emerging challenges in cyber-risk …"
253,[PDF][PDF] ML BASED MODEL FOR PHISHING WEBSITE DETECTION,"RA Kelkar, A Vijayalakshmi - challenge - jcreview.com",[PDF] jcreview.com,"RA Kelkar, A Vijayalakshmi ",,"… To test the training model, system is using feature extraction technique to extract 26 features 
using web scrapping, python, regex, parsing technique, socket programming, Selenium and 
using few python libraries to get information about SSL certificate. Random forest is giving …"
254,Architecture of a Platform on Sharing Endogenous Knowledge to Adapt to Climate Change,"H Trawina, I Diop, S Malo, Y Traore - International Conference on Software …, 2020 - Springer",Architecture of a Platform on Sharing Endogenous Knowledge to Adapt to Climate Change,"H Trawina, I Diop, S Malo, Y Traore ",2020,"… As we mentioned in the context, there are platforms on the web where researchers publish … 
Indeed, the role of the layer (D) or Scrapping layer is to make the scrapping of all of the … 
recommend using new technologies of the Web namely the Web and the semantic and social Wiki …"
255,Marketplace affiliates potential analysis using cosine similarity and vision-based page segmentation,"WB Zulfikar, M Irfan, M Ghufron, J Jumadi… - Bulletin of Electrical …, 2020 - beei.org",[PDF] beei.org,"WB Zulfikar, M Irfan, M Ghufron, J Jumadi… ",2020,"… Aslam, and SM Bhatti, “Exploiting filtering approach with web scrapping for smart online 
shopping: Penny wise: A wise tool for online … Stanišević, “Web scrapping and storing data 
in a database, a case study of the used cars market,” 2017 25th Telecommunication Forum (…"
256,[PDF][PDF] Decyphering cryptocurrencies: Sentiments and prices,P Dadar - lexjansen.com,[PDF] lexjansen.com,P Dadar ,,"… Data from these sources will be used through web scrapping and APIs to procure the data 
and proceed further with the analysis. … As the first step in the analysis, data of the daily price 
of bitcoin is procured with the help of webscrapping through open source softwares from …"
257,[PDF][PDF] An automated virtual CV for having better knowledge on the interviewee,"M Shil, MA Rahaman, H Ullah - researchgate.net",[PDF] researchgate.net,"M Shil, MA Rahaman, H Ullah ",,"… In web scrapping we have used python [4][5] programming language. During the web 
scrapping the most important thing is the authentication as the website can hold the right to give 
access to certain users and might have several restrictions. Some web pages can be accessed …"
258,[PDF][PDF] Efficient and optimized use of data-Shrimp Browser,"A Saha, A Singh, A Kumar, P Kanjani - 2016 - academia.edu",[PDF] academia.edu,"A Saha, A Singh, A Kumar, P Kanjani ",2016,"… web crawling and web scrapping and also classification technique, pattern matching 
algorithm and supervised algorithm is being. Web scrapping … But before scrapping the output, 
Web Crawlers are responsible to navigate to the destination once the crawler reaches the correct …"
259,[PDF][PDF] Not-So-Linked Solution to the Linked Data Mining Challenge 2016.,"J Potoniec - (KNOW@ LOD/CoDeS)@ ESWC, 2016 - Citeseer",[PDF] psu.edu,J Potoniec ,2016,"… As the datasets for the challenge are quite small (1592 different URIs), we did some web 
scrapping with Python and Scrapy5 to obtain reviews of considered albums. We scraped 
Wikipedia to obtain reviews collected from various websites. It rendered out to be a tedious process…"
260,A Systematic Literature Review: Instagram Fake Account Detection Based on Machine Learning,"J Ezarfelix, N Jeffrey, N Sari - Engineering, MAthematics and …, 2022 - journal.binus.ac.id",[PDF] binus.ac.id,"J Ezarfelix, N Jeffrey, N Sari ",2022,"… Web scrapping datasets from instagram that’s being labelled for the training … Users interact 
with social media using web-based software or applications on a computer, tablet, or 
smartphone. While social media is widely used in the United States and Europe, Asian countries …"
261,USING CHEMICAL VALIDATION AND STANDARDIZATION PLATFORM TO VALIDATE AND STANDARDIZE PUBLICLY AVAILABLE CHEMICAL DATA,"B Sattarov, A Khayrullina, V Tkachenko - 3rd Kazan Summer School on …, 2017 - elibrary.ru",USING CHEMICAL VALIDATION AND STANDARDIZATION PLATFORM TO VALIDATE AND STANDARDIZE PUBLICLY AVAILABLE CHEMICAL DATA,"B Sattarov, A Khayrullina, V Tkachenko ","3, 2017","… In combination with our chemical web-scrapping python library the platform delivers very 
convenient tool for building a comprehensive knowledgebase of chemical information. 
Standardization script allows user to automatically standardize all molecules in the dataset and …"
262,Web scraping techniques for price statistics–the Romanian experience,"B Oancea, M Necula - Statistical Journal of the IAOS, 2019 - content.iospress.com",Web scraping techniques for price statistics–the Romanian experience,"B Oancea, M Necula ",2019,"… The main advantage of this framework is that it can automatically access asynchronous 
and dynamic web content by simulating the interaction between a user/web browser and a 
web server. Automating the collection of information from dynamically generated content sites …"
263,An Approach to Automatic Recognition of Web Advertising Focused on Different Languages,"DR Enriquez, RP Ayala… - 2020 8th …, 2020 - ieeexplore.ieee.org",An Approach to Automatic Recognition of Web Advertising Focused on Different Languages,"DR Enriquez, RP Ayala… ","2020, 8, 2020","… All the captures and content of the Web page, object of study, were analyzed. … out with 
Selenium are not considered Web Scrapping [18], since only the sliding of the Web page is 
used. While Web Scrapping collects all the information from Web pages, taking advantage of the …"
264,[PDF][PDF] LAND VALUE CAPTURE MODELING IN COMMERCIAL AND OFFICE AREAS USING A BIG DATA APPROACH,R Woodhead - scholar.archive.org,[PDF] archive.org,R Woodhead ,,"… Data mining through web scrapping was used to assess the degree of correlation between 
price elasticity and station location. The result shows that approximately 13% of commercial 
property was spread over a distance of 1 km from the LRT station. The closer a property to …"
265,Programming languages in github: a visualization in hyperbolic plane,"D Celińska, E Kopczyński - … AAAI Conference on Web and Social Media, 2017 - ojs.aaai.org",[PDF] aaai.org,"D Celińska, E Kopczyński ",2017,"GitHub is nowadays the largest software repository hosting service that incorporates social 
media functionalities to writing and assessing source code. We visualize the weighted network 
of programming languages used by the registered users of GitHub as of December 2016. …"
266,[CITATION][C] Analysis on the Exploration of Web Scrapping Algorithms in Biomedical Research,"S Mateo, J Guford, T Harding",Save,"S Mateo, J Guford, T Harding",,
267,[PDF][PDF] RECIPE4U: An Android Application Using Web Scraping,"AF Najmuddin, SNM Bahaman, IM Ibrahim, SS Shaffie… - 2020 - pdfs.semanticscholar.org",[PDF] semanticscholar.org,"AF Najmuddin, SNM Bahaman, IM Ibrahim, SS Shaffie… ",2020,"… The objective of this study is to develop a new mobile recipe application using web 
scrapping framework where this application is … The remainder of this paper will cover on the 
review of the previous mobile recipe application and techniques for web scrapping. Section 3 …"
268,[PDF][PDF] The state of medical physics in Brazil demonstrated by research groups publications: an analytical example of bibliometrics used to investigate a scientific field,"JDS Mendes - Liinc em Revista, 2019 - revista.ibict.br",[PDF] ibict.br,JDS Mendes ,2019,"This paper addresses the paradoxical construction condition of the Medical Physics (MP) field 
in Brazil through an analysis of scientific production. Therefore, the objective is to understand 
the state of art of Brazilian MP and the methodology was based on webscrapping and …"
269,"[HTML][HTML] Towards Web-Based Monitoring Framework for Performance Measurement in Higher Education O. Cherednichenko, O. Yanholenko",O Cherednichenko - scaspee.com,[HTML] scaspee.com,O Cherednichenko ,,"… The clustering accuracy influences the probability to miss the useful web page. Web 
scrapping algorithms make challenge to unstructured data on the web. Finally, processing 
of data by Measurement Model requires estimation of reliability of obtained values of KPI. …"
270,Dynamic Analysis of Website Content Using a Mobile Application,"K Stepień, D Kossowski - … in Information & Knowledge Management for …, 2022 - Springer",Dynamic Analysis of Website Content Using a Mobile Application,"K Stepień, D Kossowski ",2022,"… The biggest challenge faced by web searching and data extraction programs are web … One 
of possible exceptions that can obey that rule are headless browsers They are web browsers 
… The utility of all applications for web scrapping is related to the requirements of the users. …"
271,Measuring inflation in Argentina: IPC Online Project,"GR Ramírez Muñoz de Toro, JI Uriarte… - … Argentino de Ciencia …, 2019 - sedici.unlp.edu.ar",Measuring inflation in Argentina: IPC Online Project,"GR Ramírez Muñoz de Toro, JI Uriarte… ",2019,"The motivation of the IPC Online, was to act and make accountable a policy that misinformed 
economic agents. It allows for cross checking to highly important variable such as prices 
with different geographical scopes. It has been shown how webscraping- data-based urban …"
272,[PDF][PDF] Identifying the ideal topology of simple models to represent dwellings,"AP Ramallo-González, M Brown, DA Coley - Proceedings of BS2015 …, 2015 - ibpsa.org",[PDF] ibpsa.org,AP Ramallo,"2015, 2015","… : data acquisition by means of web scrapping of weather stations from the Met Office; and 
data from a weather station mounted on the roof of one of the buildings of the ENLITEN set. 
The sampling period of the weather data from the web-scrapping tool is 5 minutes and from the …"
273,Geographic Information System for Higher Education via Data Scrapping,"A Alfiansyah, A Azhar - MATEC Web of Conferences, 2018 - matec-conferences.org",[PDF] matec-conferences.org,"A Alfiansyah, A Azhar ",2018,"This paper aims to build a database that can be used as the most important part of a geographic 
information system by using data from reliable sources. Data collection is done through 
process scrapping on some official website of Indonesia government. In addition to collecting …"
274,Automating Live Cricket Commentary Using Supervised Learning,"AS Hegde, K Jha, S Suganthi… - Proceedings of Data …, 2022 - Springer",Automating Live Cricket Commentary Using Supervised Learning,"AS Hegde, K Jha, S Suganthi… ",2022,"… The Selenium web driver is a tool that will help us to constantly scrape the webpage at 
the given URL, this tool will work in real time while increasing the efficiency of the web-scrapping 
process in general. The Web driver fetches the contents from the URL of the live match …"
275,[PDF][PDF] Candidate Background Verification Using Machine Learning and Fuzzy Matching,"H Suman, H Tamkiya, AS Kushwah - 2020 - researchgate.net",[PDF] researchgate.net,"H Suman, H Tamkiya, AS Kushwah ",2020,"… Selenium is a portable framework for testing web applications. Beautiful Soup is a Python 
package for parsing HTML and XML documents. It creates a parse tree for parsed pages that 
can be used to extract data from HTML, which is useful for web scraping. Scrapping correct …"
276,Smart algorithmic based web crawling and scraping with template autoupdate capabilities,"F Qudus Khan, G Tsaramirsis, N Ullah… - Concurrency and …, 2021 - Wiley Online Library",Smart algorithmic based web crawling and scraping with template autoupdate capabilities,"F Qudus Khan, G Tsaramirsis, N Ullah… ",2021,"… Apart from solutions to common problems, this research gives the developers an insight 
into the possibilities of avoiding errors during the implementation phase of their web scrapper 
tool. Although we listed and explored solutions to multiple empirical problems, web scrapping …"
277,HealthMine: A Tool for Social Media Text Mining in Health,"S Jeelall, S Cheerkoot-Jalim - 2020 3rd International …, 2020 - ieeexplore.ieee.org",HealthMine: A Tool for Social Media Text Mining in Health,"S Jeelall, S Cheerkoot","2020, 3, 2020","… However, Medhelp being a web forum does not possess any API for information retrieval. 
Hence, a web scrapping tool, JSoup has been used to retrieve posts from MedHelp. A web 
scrapper mainly works by navigating a web page’s HTML code and retrieving information found …"
278,Leveraging Publicly Available Information to Analyze Information Operations,"N Manzonelli, T Brown, A Avellandea-Ruiz… - Industrial and …, 2021 - iser.sisengr.org",Leveraging Publicly Available Information to Analyze Information Operations,"N Manzonelli, T Brown, A Avellandea",2021,"… We implement a multi-model system that involves data acquisition via web scraping and 
analysis using natural language processing (NLP) techniques with a focus on topic modeling 
and sentiment analysis. After conducting a case study on China’s current relationship with …"
279,Upoma: A Dynamic Online Price Comparison Tool for Bangladeshi E-commerce Websites,"A Alam, AA Anjum, FS Tasin, MR Reyad… - 2020 IEEE Region …, 2020 - ieeexplore.ieee.org",Upoma: A Dynamic Online Price Comparison Tool for Bangladeshi E-commerce Websites,"A Alam, AA Anjum, FS Tasin, MR Reyad… ","2020, 2020","… Thus, we have used web crawling approach to collect necessary data from different 
websites in a fast and efficient way [12]. We have built … Exploiting filtering approach with web 
scrapping for smart online shopping penny wise a wise tool for online shopping. In 2019 2nd …"
280,The Software Development for 5G New Radio Coverage Planning,"RV Akhpashev, VG Drozdova… - 2021 XV International …, 2021 - ieeexplore.ieee.org",The Software Development for 5G New Radio Coverage Planning,"RV Akhpashev, VG Drozdova… ","2021, 2021","… The selenium module is a Python 3 library providing functionality to automate web-scrapping 
or webparsing process. Those an open source Open Street Map (OSM) to collect the 
information [11] is used. … The Table III shows an example of data collected by web-scrapping. …"
281,Intelligent News Reader,"K Perera, P Kumara, B Hettige - 2017 - ir.kdu.ac.lk",[PDF] kdu.ac.lk,"K Perera, P Kumara, B Hettige ",2017,"… News which is needed for the software is taken from the prominent news websites with the 
use of web … web page for content extraction, the page is first passed through an HTML parser 
that modifies the HTML and creates a Document Object Model tree illustration of the web …"
282,[PDF][PDF] Efficient and Intelligent QUEST,"S Dongre, SS Lodhi - researchgate.net",[PDF] researchgate.net,"S Dongre, SS Lodhi ",,"… We have used PHP Framework, Web Scrapping, Ajax and MySQL queries to implement 
the system, that is able to generate proper and … the correct answer from web. That simplified 
question is sent to Google, and by using Web Scrapping it retrieves answer from web data. …"
283,An Efficient Journal Articles Searching using Vector Space Model Algorithm,"A Alvriyanto, MT Nuruzzaman… - … on Informatics for …, 2020 - ejournal.uin-suka.ac.id",[PDF] uin-suka.ac.id,"A Alvriyanto, MT Nuruzzaman… ",2020,"… Web scrapping is a process to crawl semi-structured documents from the Internet. The 
documents are normally in the markup language such as HTML or XHTML. The web scrapping 
process has four steps [6][… Once the page is obtained, it will put into the web scrapping software, …"
284,Tracking online fraud using regular expression,"F Noviyanto, D Soyusiawaty… - … on Science in …, 2017 - ieeexplore.ieee.org",[PDF] itb.ac.id,"F Noviyanto, D Soyusiawaty… ",2017,"… RegEx can identify a pattern of data that will be taken from the results of information retrieval 
from search engines or web scrapping … The implementation of web scrapping has been 
studied by Josi, et al. [7]. Their research resulted in a search engine application by applying web …"
285,Importance of web scraping in e-commerce and e-marketing,"K Henrys - Available at SSRN 3769593, 2021 - papers.ssrn.com",[PDF] researchgate.net,K Henrys ,"3769593, 2021","… large amounts of data from the web and then placing it in databases for future analysis and 
later use. Web scraping offers insight into price data, … In this article, we will explain the 
advantage of Web scraping technique and supply a practical example that can be beneficial for e-…"
286,[PDF][PDF] Data Analytics of an Olympic Games,"P Pathak, N Patil, A Patil, M Patekar - ijsrcsams.com",[PDF] ijsrcsams.com,"P Pathak, N Patil, A Patil, M Patekar ",,"… Data scrapping means retrieve relevant information from different data sources (like Kaggle, 
Sports-reference, Olympic.org) in a specific … A web scrapping code in python using the library 
package “Beautiful soup” was used to extract the data for further analytic. Web scrapping …"
287,[PDF][PDF] Impact on Stock Market across Covid-19 Outbreak,"C Gotecha, DP Parikh - academia.edu",[PDF] academia.edu,"C Gotecha, DP Parikh ",,"… web-application simple to make and share beautiful, custom web applications for AI and data 
science. Here we utilised this library to develop a web … When our application is scrapping 
sector relevant data for uncertainty in share price over the period of five years on daily interval …"
288,Analysis of web scraping techniques to get keywords suggestion and allintitle automatically from Google Search Engines,"AW Murdiyanto, A Priadana - Compiler, 2021 - ejournals.itda.ac.id",Analysis of web scraping techniques to get keywords suggestion and allintitle automatically from Google Search Engines,"AW Murdiyanto, A Priadana ",2021,"… Based on these problems, this study aimed to analyze the implementation of the web 
scraping technique to get relevant keyword suggestions from the Google search engine and the 
number of ""allintitle"" that are owned automatically. The data used as an experiment in this test …"
289,Hot Topic Extraction from News Websites,"J Katyayani - International Conference On Computational And Bio …, 2019 - Springer",[PDF] researchgate.net,J Katyayani ,2019,"… To perform web scrapping we require python built in libraries such as Pandas, BeautifulSoap. 
Install them using pip and import them into … Since we are focusing on getting the content 
from the web page, and the web pages are formed based on html tags we need to inspect the …"
290,Web scraping technique for producing Iranian consumer price index,"A Faramarzi, R Hadizadeh, S Fayyaz… - Statistical Journal of … - content.iospress.com",Web scraping technique for producing Iranian consumer price index,"A Faramarzi, R Hadizadeh, S Fayyaz… ",,"… So, it is inevitable to see errors and inconsistencies in data but in the web scrapping the 
programmers write the scripts once resulting in lesser errors in data collection. Also, in the 
web scraping approach, the data manipulation is less than the survey approach. …"
291,Ingesta de datos en un proyecto Big Data,B Rodríguez-Mon Barrera - 2019 - repositorio.comillas.edu,[PDF] comillas.edu,B Rodríguez,2019,"… La ingesta de datos se realizará mediante tecnologías de captación de datos tales como el 
WebScrapping, el acceso a APIs en tiempo … The data will be ingested using technologies 
such as Web Scrapping, access to real-time APIs or other types of multi-source data ingestion…"
292,An Approach to Analysis on Covid-19 Data Through Web Scraper and Voice Assistant–A Survey,"PK KG, HC Prabhu B, C Kumari, S Shetty… - Available at SSRN …, 2021 - papers.ssrn.com",An Approach to Analysis on Covid-19 Data Through Web Scraper and Voice Assistant–A Survey,"PK KG, HC Prabhu B, C Kumari, S Shetty… ",2021,"… Additionally, the future consequences of information gathered by web scrapping procedures 
will be used for the study of relevant weather patterns used in decision making. And the 
subsequent information is extremely definite and can be utilized further for data analysis. …"
293,WSOLINK: web structure outlier detection algorithm,"R Miglani - International Journal of Knowledge and Web …, 2016 - inderscienceonline.com",WSOLINK: web structure outlier detection algorithm,R Miglani ,2016,"… 4.1 Phase 1: web scrapping Web scrapping is the process of extracting useful data from 
the websites. In this research work, web scrapper named as Outwit Hub (as shown in Figure 
6) scraps the web documents related to nlp which is given as user search query to the Google …"
294,[PDF][PDF] Design and implementation of iMacros-based data crawler for behavioral analysis of Facebook users,"MA Wani, N Agarwal, S Jabin… - Computer Science: Social …, 2018 - academia.edu",[PDF] academia.edu,"MA Wani, N Agarwal, S Jabin… ",2018,"… Web scrapping provides an alternative solution by automatically extracting the information 
from the web pages in a systematic manner. Although it can solve the problem of data collection 
to a great extent but writing a scrapper is itself a challenging task. Generally, social media …"
295,[PDF][PDF] Opportunistic Transport Data Collection,"D Efthymiou, C Antoniou - 92nd Annual Meeting of the Transportation …, 2013 - users.ntua.gr",[PDF] ntua.gr,"D Efthymiou, C Antoniou ","92, 2013","… Web-‐scrapping • A web scrapper for data collection from publicly available real estate 
websites was developed … 3) Web-‐scrappers and 4) …"
296,Smart cities and flagship stores: lighting and contract,"A Volpe, D Cheri, S Banfi - 2021 - ideas.repec.org",Smart cities and flagship stores: lighting and contract,"A Volpe, D Cheri, S Banfi ",2021,"… cities, CSIL employed the technique of web scrapping. WEB SCRAPING (also called web 
harvesting, or web data extraction) is an IT … Usually, such programs simulate human browsing 
on the World Wide Web using the Hypertext Transfer Protocol (HTTP) or through browsers. …"
297,[PDF][PDF] an overview of Compilation of Price Statistics in Nepal,"G Bajracharya, S Sharma - OFFICIAL STATISTICS OF NEPAL: ISSUES … - nepalindata.com",[PDF] nepalindata.com,"G Bajracharya, S Sharma ",,"… such as web scrapping and … scrapping software which facilitates collection of a large-scale 
price data from internet in no time. However, the limited number of goods available in online 
outlets and blocking of web scrapping by the online outlets confines the use of web scrapping. …"
298,Toolet: An Editor for Web-Based Tool Appropriation by Hobby Programmers,"JP Contell, O Díaz - International Rapid Mashup Challenge, 2016 - Springer",Toolet: An Editor for Web-Based Tool Appropriation by Hobby Programmers,"JP Contell, O Díaz ",2016,"… in describing Web appropriation on an adequate level of abstraction. The answer very 
much depends on both the kind of Web application … No matter how data is obtained (through 
APIs, Web Scrapping or user interactions), it is all represented as table columns. Next, new …"
